{
  "title": "Framework",
  "description": "The docs framework",
  "icon": "Building",
  "root": true,
  "pages": [
    "---Introduction---",
    "index",
    "what-is-fumadocs",
    "comparisons",
    "deploying",
    "manual-installation",
    "---Writing---",
    "page-conventions",
    "markdown",
    "---Configurations---",
    "versioning",
    "static-export",
    "internationalization",
    "navigation",
    "search",
    "(integrations)",
    "---UI---",
    "...(ui)",
    "---Automation---",
    "python",
    "typescript",
    "obsidian",
    "openapi"
  ]
}
